start_time,end_time,duration,speaker,text
0.000,13.480,13.480,SPEAKER_00,oder jetzt sprechen wir und ich habe zuletzt habe ich zwei aufnahmen gemacht dort hatte ich das problem dass die aufnahme immer wieder stoppt
13.480,20.360,6.880,SPEAKER_02,automatisch. Wie lange kann das recorden?
20.360,72.880,52.520,SPEAKER_00,lange aber ich weiss nicht warum es hat gestoppt ich bin auch nicht ganz sicher ob es stoppt wirklich oder ob es nur ist eine änderung in der darstellung dass wie ein bisschen sleep mode weisst du aber vielleicht es schreibt trotzdem im hintergrund bei diesen gesprächen ich wollte das nicht riskieren und habe immer wieder gedrückt play play play dass es einfach viele viele viele ja es hat nein es war nachher ein pfeil aber immer stoppt ja ich war nicht ganz sicher ob es wirklich stoppt oder nicht ich versuche es jetzt zu demonstrieren ich weiss nicht ob es klappt haben wir station through? nein so meeting station? ja ja recording nein nein
72.880,84.600,11.720,UNK_SPEAKER_00,aber ich nicht. Vielleicht einfach laptop mit recording? ja ich weiss nicht ob jetzt
84.600,104.600,20.000,SPEAKER_00,es noch nicht stoppt ist nur bildschirm ein bisschen dunkel jetzt siehst du jetzt das das ist diese situation aber vielleicht sprechen wir jetzt einfach noch ein bisschen weiter ab jetzt hören wir das noch oder hören wir das nicht weil ich siehe keine aktivität und dann habe ich immer gemacht play play play
104.600,110.760,6.160,SPEAKER_02,aber jetzt haben wir das nicht gemacht ich denke einfach diese laptop recording
110.760,121.800,11.040,SPEAKER_00,und laptop und jetzt machen wir play aber jetzt habe ich wieder play gedrückt und jetzt machen wir einen test
